{
  "$schema": "https://json-schema.org/draft/2020-12/schema",
  "$id": "urn:apkrun:schema:android-image-manifest:1",
  "title": "APKRun AndroidImageManifest, schema version 1",
  "type": "object",
  "additionalProperties": false,
  "required": ["schemaVersion", "source", "android", "architecture", "deviceFamily", "artifacts", "roles", "logicalPartitions", "blankPartitions", "androidInfo"],
  "properties": {
    "schemaVersion": { "type": "integer", "minimum": 1 },
    "source": {
      "type": "object",
      "additionalProperties": false,
      "required": ["origin", "branch", "target", "buildId", "archives"],
      "properties": {
        "origin": { "enum": ["ci.android.com", "apkrun-builder"] },
        "branch": { "type": "string", "pattern": "^[A-Za-z0-9][A-Za-z0-9._/-]{0,127}$" },
        "target": { "type": "string", "maxLength": 128, "pattern": "^[a-z0-9][a-z0-9_-]*-(user|userdebug|eng)$" },
        "buildId": { "type": "string", "pattern": "^([0-9]{1,20}|ar[0-9]{6})$" },
        "archives": {
          "type": "array",
          "minItems": 1,
          "maxItems": 8,
          "items": {
            "type": "object",
            "additionalProperties": false,
            "required": ["name", "size", "sha256"],
            "properties": {
              "name": { "type": "string", "pattern": "^[A-Za-z0-9._+-]{1,255}$" },
              "size": { "type": "integer", "minimum": 1 },
              "sha256": { "$ref": "#/$defs/sha256" }
            }
          }
        }
      }
    },
    "android": {
      "type": "object",
      "additionalProperties": false,
      "required": ["release", "sdk", "variant", "securityPatch"],
      "properties": {
        "release": { "type": "string", "pattern": "^[1-9][0-9]*(\\.[0-9]+){0,2}$" },
        "sdk": { "type": "integer", "minimum": 1, "maximum": 10000 },
        "variant": { "enum": ["user", "userdebug", "eng"] },
        "securityPatch": { "type": "string", "pattern": "^[0-9]{4}-(0[1-9]|1[0-2])$" }
      }
    },
    "architecture": { "type": "string", "pattern": "^[a-z0-9_]{1,32}$" },
    "deviceFamily": { "type": "string", "maxLength": 64, "pattern": "^[a-z0-9]+(-[a-z0-9]+)*$" },
    "artifacts": {
      "type": "array",
      "minItems": 1,
      "maxItems": 64,
      "items": {
        "type": "object",
        "additionalProperties": false,
        "required": ["id", "file", "sha256", "size", "kind", "partition"],
        "properties": {
          "id": { "$ref": "#/$defs/artifactId" },
          "file": {
            "type": "string",
            "maxLength": 255,
            "pattern": "^[A-Za-z0-9._+-]+(/[A-Za-z0-9._+-]+)*$",
            "not": { "pattern": "(^|/)\\.{1,2}(/|$)" }
          },
          "sha256": { "$ref": "#/$defs/sha256" },
          "size": { "type": "integer", "minimum": 1 },
          "kind": { "enum": ["bootImage", "vendorBootImage", "vbmeta", "sparse", "dynamicPartitions", "filesystem", "unknown"] },
          "partition": { "$ref": "#/$defs/partition" }
        }
      }
    },
    "roles": {
      "type": "object",
      "additionalProperties": false,
      "required": ["kernel", "genericRamdisk", "vendorBoot", "vbmeta", "super"],
      "properties": {
        "kernel": { "$ref": "#/$defs/artifactId" },
        "genericRamdisk": { "$ref": "#/$defs/artifactId" },
        "vendorBoot": { "$ref": "#/$defs/artifactId" },
        "vbmeta": { "type": "array", "minItems": 1, "maxItems": 16, "uniqueItems": true, "items": { "$ref": "#/$defs/artifactId" } },
        "super": { "$ref": "#/$defs/artifactId" },
        "userdataTemplate": { "$ref": "#/$defs/artifactId" }
      }
    },
    "logicalPartitions": {
      "type": "array",
      "minItems": 1,
      "maxItems": 64,
      "items": {
        "type": "object",
        "additionalProperties": false,
        "required": ["name", "size", "filesystem"],
        "properties": {
          "name": { "type": "string", "pattern": "^[a-z][a-z0-9_]{0,35}$" },
          "size": { "type": "integer", "minimum": 512, "multipleOf": 512 },
          "filesystem": { "enum": ["ext4", "erofs", "f2fs", "unknown"] }
        }
      }
    },
    "blankPartitions": {
      "type": "array",
      "maxItems": 32,
      "items": {
        "type": "object",
        "additionalProperties": false,
        "required": ["partition", "size"],
        "properties": {
          "partition": { "$ref": "#/$defs/partition" },
          "size": { "type": "integer", "minimum": 4096, "multipleOf": 4096 }
        }
      }
    },
    "androidInfo": {
      "type": "object",
      "propertyNames": { "pattern": "^[A-Za-z0-9_.-]{1,64}$" },
      "additionalProperties": { "type": "string", "maxLength": 1024 }
    }
  },
  "$defs": {
    "sha256": { "type": "string", "pattern": "^[0-9a-f]{64}$" },
    "artifactId": { "type": "string", "pattern": "^[a-z][a-z0-9_]{0,35}$" },
    "partition": { "type": "string", "pattern": "^[a-z][a-z0-9_]{0,33}$" }
  }
}
